{
  "schemaVersion": "ai-partner.animation-intent.v1",
  "body": {
    "animation": "physical.falling",
    "procedural": ["drop"],
    "loop": false,
    "source": {
      "kind": "png-sequence",
      "frames": ["asset://localhost/physical-falling/000.png"],
      "fps": 8
    }
  },
  "bubble": {
    "state": "done",
    "text": "已完成",
    "priority": "normal"
  },
  "queued": [
    {
      "animation": "workflow.done",
      "reason": "physical-override",
      "expiresAt": "2026-06-02T00:00:05Z"
    }
  ]
}
